{
  "$schema": "http://json-schema.org/draft-07/schema#",
  "$id": "https://github.com/user/oh-my-opencode-switch/schemas/proxy-config.schema.json",
  "title": "Proxy Configuration",
  "description": "Configuration schema for the oh-my-opencode proxy server with load balancing support",
  "type": "object",
  "properties": {
    "version": {
      "$ref": "#/definitions/version"
    },
    "port": {
      "$ref": "#/definitions/port"
    },
    "routes": {
      "$ref": "#/definitions/routes"
    },
    "auth": {
      "$ref": "#/definitions/auth"
    },
    "mcpProxy": {
      "$ref": "#/definitions/mcpProxy"
    },
    "reliability": {
      "$ref": "#/definitions/reliability"
    }
  },
  "definitions": {
    "version": {
      "type": "integer",
      "const": 1,
      "description": "Configuration schema version, currently fixed at 1"
    },
    "port": {
      "type": "integer",
      "minimum": 1,
      "default": 3000,
      "description": "Port number for the proxy server to listen on"
    },
    "upstream": {
      "type": "object",
      "properties": {
        "id": {
          "type": "string",
          "minLength": 1,
          "description": "Unique identifier for this upstream (optional, auto-generated if not provided)"
        },
        "provider": {
          "type": "string",
          "minLength": 1,
          "description": "Provider name (e.g., 'ali', 'baidu', 'openai')"
        },
        "model": {
          "type": "string",
          "minLength": 1,
          "description": "Model name to use from this provider"
        },
        "baseURL": {
          "type": "string",
          "format": "uri",
          "description": "Custom base URL for the provider API (optional)"
        },
        "apiKey": {
          "type": ["string", "null"],
          "description": "API key for authentication (optional, can be null)"
        },
        "weight": {
          "type": "number",
          "minimum": 0,
          "exclusiveMinimum": 0,
          "description": "Weight for weighted load balancing strategy (positive number)"
        },
        "metadata": {
          "type": "object",
          "additionalProperties": true,
          "description": "Additional metadata for this upstream"
        },
        "timeSlotWeights": {
          "type": "object",
          "description": "Time-slot weight configuration for cost control. When configured, replaces upstream.weight based on current time slot.",
          "properties": {
            "high": {
              "type": "number",
              "minimum": 0,
              "description": "Weight for high load periods (10-11, 13-17)"
            },
            "medium": {
              "type": "number",
              "minimum": 0,
              "description": "Weight for medium load periods (8-9, 12, 18-20)"
            },
            "low": {
              "type": "number",
              "minimum": 0,
              "description": "Weight for low load periods (21-23, 0-7)"
            }
          },
          "additionalProperties": false
        }
      },
      "required": ["provider", "model"],
      "additionalProperties": false,
      "description": "Upstream configuration representing a backend model provider"
    },
    "dynamicWeight": {
      "type": "object",
      "properties": {
        "enabled": {
          "type": "boolean",
          "default": true,
          "description": "Enable or disable dynamic weight adjustment based on latency"
        },
        "initialWeight": {
          "type": "integer",
          "minimum": 1,
          "default": 100,
          "description": "Initial weight value for new upstreams"
        },
        "minWeight": {
          "type": "integer",
          "minimum": 1,
          "default": 10,
          "description": "Minimum weight value to prevent complete traffic cutoff"
        },
        "checkInterval": {
          "type": "integer",
          "minimum": 1,
          "default": 10,
          "description": "Interval in seconds between weight adjustment checks"
        },
        "latencyThreshold": {
          "type": "number",
          "minimum": 0,
          "exclusiveMinimum": 0,
          "default": 1.5,
          "description": "Latency multiplier threshold above which weight is reduced"
        },
        "recoveryInterval": {
          "type": "integer",
          "minimum": 1,
          "default": 300000,
          "description": "Interval in milliseconds between weight recovery steps"
        },
        "recoveryAmount": {
          "type": "integer",
          "minimum": 1,
          "default": 1,
          "description": "Amount to increase weight during each recovery step"
        }
      },
      "required": [],
      "additionalProperties": false,
      "description": "Dynamic weight adjustment configuration for latency-based load balancing"
    },
    "timeSlotWeight": {
      "type": "object",
      "properties": {
        "enabled": {
          "type": "boolean",
          "default": true,
          "description": "Enable or disable time-slot based weight adjustment"
        },
        "totalErrorThreshold": {
          "type": "number",
          "minimum": 0,
          "exclusiveMinimum": 0,
          "default": 0.01,
          "description": "Total error rate threshold for triggering weight adjustment"
        },
        "dangerSlotThreshold": {
          "type": "number",
          "minimum": 0,
          "exclusiveMinimum": 0,
          "default": 0.05,
          "description": "Error rate threshold for marking a time slot as dangerous"
        },
        "dangerMultiplier": {
          "type": "number",
          "minimum": 0,
          "exclusiveMinimum": 0,
          "default": 0.5,
          "description": "Weight multiplier for dangerous time slots"
        },
        "normalMultiplier": {
          "type": "number",
          "minimum": 0,
          "exclusiveMinimum": 0,
          "default": 2.0,
          "description": "Weight multiplier for normal time slots"
        },
        "lookbackDays": {
          "type": "integer",
          "minimum": 1,
          "default": 7,
          "description": "Number of days to look back for error rate calculation"
        }
      },
      "required": [],
      "additionalProperties": false,
      "description": "Time-slot based weight adjustment configuration for historical error patterns",
      "default": {
        "enabled": true,
        "totalErrorThreshold": 0.01,
        "dangerSlotThreshold": 0.05,
        "dangerMultiplier": 0.5,
        "normalMultiplier": 2.0,
        "lookbackDays": 7
      }
    },
    "thinking": {
      "type": "object",
      "properties": {
        "type": {
          "type": "string",
          "description": "Thinking mode type (e.g., 'enabled', 'disabled')"
        },
        "budgetTokens": {
          "type": "integer",
          "minimum": 1,
          "description": "Token budget for thinking"
        }
      },
      "required": ["type"],
      "additionalProperties": true,
      "description": "Route-level thinking configuration override. When set, overrides upstream metadata thinking as highest priority during register."
    },
    "route": {
      "type": "object",
      "properties": {
        "protocol": {
          "type": "string",
          "enum": ["chat", "responses"],
          "default": "chat",
          "description": "API protocol: 'chat' uses the full transformation pipeline, 'responses' is a passthrough with only model replacement"
        },
        "strategy": {
          "type": "string",
          "enum": ["sticky"],
          "default": "sticky",
          "description": "Load balancing strategy: sticky (会话粘滞). Note: Old strategies (round-robin, random, weighted) are accepted for backward compatibility but silently convert to sticky."
        },
        "upstreams": {
          "type": "array",
          "minItems": 1,
          "items": {
            "$ref": "#/definitions/upstream"
          },
          "description": "List of upstream providers for this route"
        },
        "metadata": {
          "type": "object",
          "additionalProperties": true,
          "description": "Additional metadata for this route"
        },
        "dynamicWeight": {
          "$ref": "#/definitions/dynamicWeight"
        },
        "timeSlotWeight": {
          "$ref": "#/definitions/timeSlotWeight"
        },
        "thinking": {
          "$ref": "#/definitions/thinking"
        },
        "reasoningEffort": {
          "type": "string",
          "enum": ["low", "medium", "high"],
          "description": "Route-level reasoning effort override. When set, overrides upstream metadata reasoning.effort as highest priority during register."
        }
      },
      "required": ["upstreams"],
      "additionalProperties": false,
      "description": "Route configuration defining a virtual model and its upstreams"
    },
    "routes": {
      "type": "object",
      "additionalProperties": {
        "$ref": "#/definitions/route"
      },
      "default": {},
      "description": "Map of route names to route configurations. Route names become virtual model names."
    },
    "authKey": {
      "type": "object",
      "properties": {
        "key": {
          "type": "string",
          "minLength": 1,
          "description": "API key string for authentication"
        },
        "name": {
          "type": "string",
          "minLength": 1,
          "description": "Human-readable name for this API key"
        },
        "enabled": {
          "type": "boolean",
          "default": true,
          "description": "Whether this API key is currently active"
        }
      },
      "required": ["key", "name"],
      "additionalProperties": false,
      "description": "Single API key configuration for proxy authentication"
    },
    "auth": {
      "type": "object",
      "properties": {
        "enabled": {
          "type": "boolean",
          "default": false,
          "description": "Enable or disable API key authentication for the proxy"
        },
        "keys": {
          "type": "array",
          "items": {
            "$ref": "#/definitions/authKey"
          },
          "default": [],
          "description": "List of API keys for authentication"
        }
      },
      "required": [],
      "additionalProperties": false,
      "description": "Authentication configuration for the proxy server"
    },
    "mcpProxyEntry": {
      "type": "object",
      "properties": {
        "upstream": {
          "type": "string",
          "format": "uri",
          "description": "Upstream MCP server URL to proxy to"
        },
        "path": {
          "type": "string",
          "minLength": 1,
          "pattern": "^/(?!_internal/)",
          "description": "Local path to expose this MCP proxy at (must start with /, must NOT start with /_internal/)"
        }
      },
      "required": ["upstream", "path"],
      "additionalProperties": false,
      "description": "Single MCP proxy entry configuration"
    },
    "mcpProxy": {
      "type": "object",
      "additionalProperties": {
        "$ref": "#/definitions/mcpProxyEntry"
      },
      "description": "Map of MCP proxy names to their configurations. Each entry creates a proxy endpoint."
    },
    "reliability": {
      "type": "object",
      "properties": {
        "allowedFails": {
          "type": "integer",
          "default": 2,
          "description": "Consecutive failures before tripping circuit breaker"
        },
        "cooldownTimeMs": {
          "type": "integer",
          "default": 60000,
          "description": "Cooldown time before HALF_OPEN probe"
        }
      },
      "required": [],
      "additionalProperties": false,
      "description": "Reliability configuration for circuit breaker and failure handling"
    }
  }
}
