{
  "$schema": "https://raw.githubusercontent.com/zxy16305/oh-my-opencode-switch/master/schemas/proxy-config.schema.json",
  "port": 3000,
  "auth": {
    "enabled": false,
    "keys": [
      { "key": "sk-your-api-key-1", "name": "dev-key", "enabled": true },
      { "key": "sk-your-api-key-2", "name": "prod-key", "enabled": false }
    ]
  },
  "reliability": {
    "allowedFails": 2,
    "cooldownTimeMs": 60000
  },
  "routes": {
    "lb-qwen-plus": {
      "upstreams": [
        { "provider": "ali", "model": "qwen-plus" },
        { "provider": "ali", "model": "qwen-plus" }
      ]
    },
    "lb-mixed": {
      "thinking": {
        "type": "enabled",
        "budgetTokens": 8192
      },
      "reasoningEffort": "high",
      "upstreams": [
        {
          "provider": "ali",
          "model": "glm-4.7",
          "timeSlotWeights": { "high": 50, "medium": 100, "low": 150 }
        },
        { "provider": "baidu", "model": "qianfan-code-latest" }
      ]
    }
  }
}
